Datetime,Text,Username,sentiment,user
2017-02-24 22:50:28+00:00,Its freedom of the press  It's playing favorites to right leaning press  It sets a precedent but it will backfire ,patrickwilson73,0.5994,3
2017-02-24 22:19:35+00:00,This is ridiculous  And cowardly  And before any Trump supporters clamor to  Obama did it too  Check your facts  https t co bdHvKkYTkJ,patrickwilson73,-0.296,3
2017-02-22 23:42:06+00:00,Hey Wasn't this the opening sequence to OUR Batman  Thanks for this  https t co L4Paq0UWUD,patrickwilson73,0.4404,3
2017-02-14 14:56:34+00:00,Happy Valentine's Day  wifey    https t co gRp25rAeKK,patrickwilson73,0.5719,3
2017-02-11 17:29:07+00:00,Yep  It's just what we do  Pompadoured  God fearing  music makers  we'd LOVE to promote this on the show  Fellas  https t co 8WvI95lwTb,patrickwilson73,0.7983,3
2017-02-03 18:07:33+00:00,Yes  Loved him since Once Were Warriors  https t co wSTscoaoV1,patrickwilson73,0.765,3
2017-02-03 17:02:08+00:00,You are a funny man  John Jacob Jingleheimer Conlee https t co 24OiKSSGNX,patrickwilson73,0.4404,3
2017-02-03 13:57:14+00:00,Like  Old  Aloha from Hawaii Elvis  Or sweaty leather '68 comeback  I'm down either way  I just need to know which weight plan to start  https t co vNCVCt4cG9,patrickwilson73,0.3612,3
2017-02-03 13:54:12+00:00,congrats on The Nun  She can haunt YOU now  Welcome to the family   ,patrickwilson73,0.5719,3
2017-01-29 00:04:06+00:00,This is unbelievable  Thank you to all who still honor the words on the Statue of Liberty  https t co 0qietAzBiN,patrickwilson73,0.872,3
2017-01-28 04:16:46+00:00, Time to call a few friends  Matthew Goode and Billy Crudup  Let's go  https t co cMBhS7QBXK,patrickwilson73,0.4767,3
2017-01-25 04:45:11+00:00,Hey  Hey  Hey  Oh  https t co eR25SrF1zw,patrickwilson73,0,3
2017-01-23 12:54:19+00:00,Yes  Yes it is    First gig  That headshot is solid  https t co JtJVNtAvxn,patrickwilson73,0.7184,3
2017-01-21 17:07:07+00:00,thank you for your service ,patrickwilson73,0.3612,3
2017-01-21 16:05:41+00:00, and now that I've read a bit of your hateful thread  good riddance  Love wins ,patrickwilson73,0.8225,3
2017-01-21 15:58:15+00:00,ok  I'll bite  This is bigger than Trump  This is about human rights  CIVIL rights  Unfollow away ,patrickwilson73,0.296,3
2017-01-21 14:00:10+00:00,Dammit  Leave it to the Brits to be the wittiest  Be safe over there  https t co lAHKabszlM,patrickwilson73,0.4019,3
2017-01-21 13:58:44+00:00,To my amazing wife   sister amp mother in law  dear friend and all the WOMEN who are marching  WE STAND WITH YOU  Be safe ,patrickwilson73,0.91,3
2017-01-19 22:44:41+00:00,He was a badass indeed  https t co 5nhGz81l9v,patrickwilson73,-0.1531,3
2017-01-19 16:19:41+00:00,If you haven't see this film  this is a great time to see it  Amazing and timely  https t co vb1BBGvSoy,patrickwilson73,0.836,3
2017-01-18 14:10:19+00:00,Hope the show went well  I miss you guys    https t co 7ammnT6x8o,patrickwilson73,0.5267,3
2017-01-16 00:25:16+00:00,There is  It's called wifi  And I've yet to receive it  Oh  and   thanks for throwing it down for my wifey today    https t co FIwQOUohh6,patrickwilson73,0.4404,3
2017-01-14 14:38:55+00:00,Dude  I wouldn't TOUCH a remake of BIG  Just sayin'  https t co TXdL6T1jbd,patrickwilson73,0,3
2017-01-09 20:21:39+00:00,Well said  wifey  https t co A0gCWehnWE,patrickwilson73,0.2732,3
2017-01-08 18:19:38+00:00,This is ridiculously funny  https t co AVCWWMEJfA,patrickwilson73,0.128,3
2017-01-04 04:59:17+00:00,happy birthday   ,patrickwilson73,0.5719,3
2016-12-31 06:01:37+00:00,Mylanta  That was insane  Congrats to  UFC207,patrickwilson73,0.1779,3
2016-12-24 17:42:50+00:00,I feel violated  https t co KmZdJhGspW,patrickwilson73,-0.5267,3
2016-12-24 17:42:16+00:00,Lotta green  A LOT of green  Happy Holidays everybody  https t co CaQAIbcAvk,patrickwilson73,0.743,3
2016-12-22 13:09:48+00:00,Produced by the great Aaron Ginsburg and the badasses at Atlas Independent    https t co muwn944GCn,patrickwilson73,0.6249,3
2016-12-21 20:40:15+00:00,Thank you for the new kicks  Turns out a lifetime guarantee works    https t co yynILh2wdf,patrickwilson73,0.5423,3
2016-12-20 21:41:25+00:00,Yes indeed  Orm has to prepare for a battle or two  https t co bb6NVkzzKQ,patrickwilson73,0.0258,3
2016-12-20 21:38:23+00:00,Oh yah  Gonna be a great season  https t co i1yawlBK31,patrickwilson73,0.6249,3
2016-12-16 19:13:32+00:00, on the other side of the spectrum  we have  theHollowPoint  Also on demand and in theaters  Busy wknd for Pwilly indies    see them  https t co ykDibBeR3F,patrickwilson73,-0.128,3
2016-12-16 19:05:52+00:00,See this movie  We had such a blast making it  a very intriguing murder mystery  as every P  Highsmith story should be    https t co eVtIx8pQjo,patrickwilson73,-0.7165,3
2016-12-12 22:41:40+00:00,Teehee  Here we go  https t co n06e5bV0kw,patrickwilson73,0,3
2016-12-07 00:04:56+00:00,Love this    https t co KiVNTufLfn,patrickwilson73,0.6369,3
2016-12-05 23:19:32+00:00,yep  Followed,patrickwilson73,0.296,3
2016-12-04 06:32:55+00:00,don't die a little  Donna  Time to go to bed    take care ,patrickwilson73,0.7466,3
2016-12-04 06:26:42+00:00,Phone  and phone user  nearly dead  Thanks for playing all  sorry I didn't get to everyone  Great questions all around   ,patrickwilson73,0.4939,3
2016-12-04 06:23:48+00:00,Besides Curling  Gotta go soccer to play  Football to watch on tv  Hockey live  https t co kYvBFi9Ee6,patrickwilson73,0.34,3
2016-12-04 06:22:36+00:00,ooo  Sure  Any dumb time in my youth where I screwed up  I'm sure it  made me stronger  but I could erase a few nights ,patrickwilson73,-0.0387,3
2016-12-04 06:20:38+00:00,very ,patrickwilson73,0,3
2016-12-04 06:20:27+00:00,has there been one    I'll say Poltergeist because I don't consider The Shining a horror movie ,patrickwilson73,-0.5719,3
2016-12-04 06:16:26+00:00,beach,patrickwilson73,0,3
2016-12-04 06:16:01+00:00,favorite  Numero uno ,patrickwilson73,0.4588,3
2016-12-04 06:15:30+00:00,many many stories that I will take to the bar  I mean  GRAVE ,patrickwilson73,-0.516,3
2016-12-04 06:14:28+00:00,yes I am  So creative and special ,patrickwilson73,0.8341,3
2016-12-04 06:13:57+00:00,dogs  Dogs  Dogs ,patrickwilson73,0,3
2016-12-04 06:13:29+00:00, the subject matter made it a wee bit complicated but I adore her and she's wonderful in the flick    https t co ZWSQJiCai7,patrickwilson73,0.9001,3
2016-12-04 06:12:20+00:00,yep  Fun,patrickwilson73,0.6705,3
2016-12-04 06:11:29+00:00,finding song s  now ,patrickwilson73,0,3
2016-12-04 06:11:03+00:00,Yes I will  Trying as we speak  https t co MBOqXbgGwo,patrickwilson73,0.4019,3
2016-12-04 06:10:34+00:00,merry Christmas indeed   ,patrickwilson73,0.5423,3
2016-12-04 06:10:08+00:00,thanks man ,patrickwilson73,0.4404,3
2016-12-04 06:09:25+00:00,I Go Through  https t co YswKrE7ZBJ,patrickwilson73,0,3
2016-12-04 06:07:10+00:00,Don't hate them but not a big candy guy  I do love a good Dud though  https t co GvptiJgNsu,patrickwilson73,0.8793,3
2016-12-04 06:06:35+00:00,Yes  https t co 3Spy2u6NpS,patrickwilson73,0.4019,3
2016-12-04 06:06:22+00:00,For the most boring answer in the world pizza  Or bacon  Or bacon in pizza  With a steak  And a beer  Then  https t co nbJ6IGXxL6,patrickwilson73,-0.3804,3
2016-12-04 06:05:32+00:00,Strangely  no  https t co yIzKscCS8o,patrickwilson73,-0.5267,3
2016-12-04 06:02:28+00:00,West side  then Carousel  https t co vjg70jsxDV,patrickwilson73,0,3
2016-12-04 06:01:41+00:00,The late night  dance walks  from Soho to Kensington with Aaron Cooley    https t co zmy2XgZath,patrickwilson73,0,3
2016-12-04 05:57:12+00:00,Dinners with     https t co QZc1B7Byfp,patrickwilson73,0,3
2016-12-04 05:54:56+00:00,Depends on the gap  https t co oZ4HAwjw1W,patrickwilson73,0,3
2016-12-04 05:54:15+00:00,Don't know you but I don't hate anyone    https t co S91ZUUIXgx,patrickwilson73,0.612,3
2016-12-04 05:53:40+00:00,Who can't  I say  Umm no  https t co ijcCDZhY47,patrickwilson73,0.2235,3
2016-12-04 05:52:54+00:00,The cast  https t co EYns0EG036,patrickwilson73,0,3
2016-12-04 05:52:40+00:00,I don't watch much tv but I couldn't stop watching Breaking Bad  https t co sHW0zevv8e,patrickwilson73,-0.5296,3
2016-12-04 05:49:03+00:00,Who is she  oh right  Her  Yeaaaah  She's pretty special    https t co a8BkPPpkYL,patrickwilson73,0.7096,3
2016-12-04 05:47:56+00:00,Yes I am    https t co 6cwNlMUfkr,patrickwilson73,0.4019,3
2016-12-04 05:46:21+00:00,You'll know soooooon    https t co TB2tK3IuCk,patrickwilson73,0,3
2016-12-04 05:46:03+00:00,The dude who tried to conduct an interview as The Nun  https t co EoNtMXkRH5,patrickwilson73,0,3
2016-12-04 05:45:12+00:00,Blue https t co fMAUI6KuY0,patrickwilson73,0,3
2016-12-04 05:44:50+00:00,Awesome  Long  I think I'm still there  Watching Conor win was pretty special  A ton of great fights and hated to see lose  https t co 0b2pc2fw7C,patrickwilson73,0.8519,3
2016-12-04 05:42:49+00:00,My dog Alma    https t co DJDQ37CNDN,patrickwilson73,0,3
2016-12-04 05:42:25+00:00,Tough call  I'll go local  Applegate Farms Graham Central Station  https t co U0YvRZ94bB,patrickwilson73,-0.128,3
2016-12-04 05:41:39+00:00,I did  I actually did  I remember  in skibo  thinking  Groban  amp  O'malley are gonna THROW DOWN in about 15 years  It just made sense  https t co O4UzDBZg3k,patrickwilson73,0,3
2016-12-04 05:39:51+00:00,Ok people  Phones on 10  I'll answer questions till it dies  But only about the UFC TUF final  Kidding  Go   ,patrickwilson73,0.296,3
2016-12-04 05:37:27+00:00, and sorry we couldn't come back  and I have so much praise it can't be contained in 140 characters   ,patrickwilson73,0.5542,3
2016-12-04 05:30:15+00:00,I totally just saw this tweet  https t co e7dj4ht44b,patrickwilson73,0,3
2016-12-04 05:19:12+00:00,Killer job tonight  all right down to the  7500 mustached pic   ,patrickwilson73,-0.6486,3
2016-12-03 16:26:02+00:00,umm about that durability  This happened yesterday in NYC  Perhaps I stepped in a vat of acid  https t co GkqWaPXRUL,patrickwilson73,0,3
2016-11-29 13:54:22+00:00, then you've been more than me    I went in once  got a slice  they took about 20 crappy pics  blew up 1  hung it in 2 shops  Surprise  https t co Qy7lCaSkrx,patrickwilson73,-0.3612,3
2016-11-28 01:21:30+00:00,Love this  Oh  and hope everyone had a Happy Thanksgiving    https t co gUJYRVGG7B,patrickwilson73,0.8957,3
2016-11-18 13:41:11+00:00,Here's to a speedy recovery   GoBolts https t co 1iNeANRESl,patrickwilson73,0,3
2016-11-17 01:00:12+00:00,That's funny  And true  All of it  https t co NQLzAKVZUH,patrickwilson73,0.6908,3
2016-11-14 20:46:13+00:00,Oy  Here we go  https t co Oc2M2PTU1z,patrickwilson73,0,3
2016-11-11 15:24:05+00:00,To my dad  both granddads  my uncle  great uncles  high school hero Dan Lynn   amp  every vet who has served and continues to  thank you ,patrickwilson73,0.8807,3
2016-11-10 19:31:19+00:00,Stay  In  Canada  https t co W3h4T3iyeZ,patrickwilson73,0,3
2016-11-10 16:30:45+00:00,Are you dressing in that RV or driving it  https t co DiUlVI6qBr,patrickwilson73,0,3
2016-11-09 22:50:54+00:00,Let's talk about something fun  How's about  ufc205  Can't wait  I'll be there  Cheering on MANY  Including Let's do this ,patrickwilson73,0.765,3
2016-11-06 13:32:09+00:00,Have a safe run today If you're reading this NOW  put your phone away  pick out someone up ahead  and catch them ,patrickwilson73,0.4404,3
2016-11-01 02:30:18+00:00,My owl ship is a grocery cart  https t co kgrrKzTdyE,patrickwilson73,0,3
2016-10-31 20:06:13+00:00,You mean Dick Tater  https t co Ys8LfKDAqr,patrickwilson73,-0.5106,3
2016-10-30 23:52:35+00:00,Crap  you started this whole thing  favorite role  Ah jeez  Impossible  Just spelling a few would fill up this tweet  What's YOURS  https t co d1JnrXU7dQ,patrickwilson73,0.1027,3
2016-10-30 23:45:59+00:00,Ok  Been fun  all  A random question and answer session at 7 44  Time to bathe the kids  and that's not a euphemism ,patrickwilson73,0.6705,3
2016-10-30 23:44:12+00:00,too many to name  Keaton  Hanks  Pacino  Newman  Deniro  Kevin Kline  Kevin KLINE  How good is he ,patrickwilson73,0.4404,3
2016-10-30 23:42:44+00:00,Beatles,patrickwilson73,0,3
2016-10-30 23:42:35+00:00,hi ,patrickwilson73,0,3
2016-10-30 23:42:24+00:00,noticed  Beastmotel  Holy crap ,patrickwilson73,-0.3818,3
2016-10-30 23:40:48+00:00, there is that ,patrickwilson73,0,3
2016-10-30 23:39:00+00:00, ,patrickwilson73,0,3
2016-10-30 23:38:50+00:00,Tweeted https t co IiMvcGZMN0,patrickwilson73,0,3
2016-10-30 23:38:00+00:00,depends on the crowd ,patrickwilson73,0,3
2016-10-30 23:37:45+00:00,Twitter  https t co 8on0wTrg9I,patrickwilson73,0,3
2016-10-30 23:37:23+00:00,Steve perry,patrickwilson73,0,3
2016-10-30 23:36:33+00:00,I'd send you so many things if I ONLY KNEW YOUR ADRESS  I'll settle for  hi  https t co bSCglTAUis,patrickwilson73,0,3
2016-10-30 23:35:35+00:00,Best  Gene Simmons from Dressed to Kill album cover  Worst  R2 D2 in 1981  It split before I went out ,patrickwilson73,-0.6808,3
2016-10-30 23:32:54+00:00,so many jokes here  I'll just say  ew ,patrickwilson73,0.3134,3
2016-10-30 23:32:13+00:00,Ed  Hands down  Then helps Don up  gives him  63 for a cup o' joe forgetting that coffee now costs  4 00 https t co tIiWHOxNEk,patrickwilson73,0.3818,3
2016-10-30 23:31:05+00:00,The next one  https t co oqhVIBDMZh,patrickwilson73,0,3
2016-10-30 23:30:37+00:00,yes would be fun  And my kids would love it   ,patrickwilson73,0.8807,3
2016-10-30 23:27:02+00:00,Right now it's that kid singing  I play Pok mon go eveRYday  https t co 37LlTCIzot,patrickwilson73,0.34,3
2016-10-30 03:06:40+00:00,It's in the way that you use it    https t co 8hdo4dKwRd,patrickwilson73,0,3
2016-10-28 20:17:16+00:00, and thank you for finding it  https t co ogOWBmNlf5,patrickwilson73,0.3612,3
2016-10-28 20:12:34+00:00,ACTUAL still from Hey you should've never cut DSP from the flick  Happy Halloween weekend    https t co Du6k9wweqC,patrickwilson73,0.672,3
2016-10-21 15:48:09+00:00,Yes   GoBolts https t co m0CTBObhbQ,patrickwilson73,0.4019,3
2016-10-20 13:24:11+00:00,Congrats    https t co zxKML5edpn,patrickwilson73,0.5267,3
2016-10-19 02:57:06+00:00,Fantastic   GoBolts https t co Ohysu2kVDx,patrickwilson73,0.5574,3
2016-10-17 18:15:55+00:00,Woohoo  https t co I0oCGVgmvR,patrickwilson73,0.5106,3
2016-10-15 00:00:27+00:00,I thought it was just bad makeup  Like  really bad  https t co xdLf1ekI2O,patrickwilson73,-0.6705,3
2016-10-14 23:22:13+00:00,Looks really great  And so lifelike  Much more than A Team  https t co YMBbEuRewA,patrickwilson73,0.659,3
2016-10-11 13:02:17+00:00,One of the most memorable days of my life    https t co uqbLBu6cdQ,patrickwilson73,0,3
2016-10-11 03:33:51+00:00,Phew  Nice win https t co UqBOzFoRhy,patrickwilson73,0.765,3
2016-10-11 01:22:22+00:00,I'm good  Donna  How are you  Thanks for all your tweets   ,patrickwilson73,0.7003,3
2016-10-11 00:33:04+00:00,Let's do this  MNF,patrickwilson73,0,3
2016-10-08 05:32:06+00:00,Congrats  Apparently you can READ an apology speech  Zzzzzzzzzzzzz  https t co puBjUKElKW,patrickwilson73,0.5574,3
2016-10-04 00:14:51+00:00,Enjoy  Git ready  https t co RVBKHsG3Ji,patrickwilson73,0.6908,3
2016-09-28 16:06:56+00:00,And  Rose Byrne is one of the common links from above    https t co l4NQVey4HH,patrickwilson73,0,3
2016-09-22 16:23:53+00:00,I'd like to take a moment and tell how very very good he is  It's f kin Larry    https t co Xpu2obzimF,patrickwilson73,0.7159,3
2016-09-20 01:05:41+00:00,every time I bench press  I now think of you asking me  a la 1987   my friends wanna know what you bench   ,patrickwilson73,0.4767,3
2016-09-18 21:48:09+00:00,Good luck to my family tonight  Congrats to and the cast crew for all the well deserved accolades   Emmys,patrickwilson73,0.886,3
2016-09-14 11:33:45+00:00,Happy Anniversary   love you guys  https t co zEPOPLEiM7,patrickwilson73,0.836,3
2016-09-13 17:19:20+00:00,Great times  Thank you thank you for the votes    https t co j5JkZnGOwn,patrickwilson73,0.8442,3
2016-09-07 20:06:03+00:00,It was a mess  And so negative  And to think I turned down an audition for Hello Erections  What could've been  https t co DzPzo39u40,patrickwilson73,-0.7574,3
2016-09-07 11:50:30+00:00,A double Happy Birthday to Ed Warren and more importantly  My wonderful mom  Mary K  Wilson ,patrickwilson73,0.8822,3
2016-09-07 07:16:46+00:00,I did the pilot of Do You Poop Enough  https t co lUfKT0ukJD,patrickwilson73,0,3
2016-09-05 19:40:44+00:00,Fantastic and daunting  He was the real deal  Or rather  the reel deal  https t co uEbIBYZHTT,patrickwilson73,0.5574,3
2016-09-01 12:54:12+00:00,Hey  Do yourself a favor and buy this  Top to bottom a fantastic album  An honor to sing with icon https t co mkNJc3A8ED,patrickwilson73,0.8885,3
2016-08-30 21:57:27+00:00,Wanna see something cool  Check out my duet with the legendary for  BarbraENCORE  tonight at 7p ET PT on  ,patrickwilson73,0.3182,3
2016-08-29 22:11:44+00:00,A masterful comedian  Every performance was a gift  RIP Gene Wilder https t co TDSsbzKfBS,patrickwilson73,0.6705,3
2016-08-29 22:09:05+00:00,I had a pretty good partner  Thank you for the opportunity of a lifetime  https t co 8AVvOXBrtN,patrickwilson73,0.886,3
2016-08-24 17:23:59+00:00,Yes yes  Please listen  And delete the picture on the right  That mayyy be the worst picture of me ever  https t co LiU50QHuu1,patrickwilson73,0.3818,3
2016-08-17 18:35:50+00:00,Gooooo By that I mean goo  Not go  https t co bjKA940VG4,patrickwilson73,0,3
2016-08-16 02:03:09+00:00,Spread the word and help those affected  I love this town Shot 2 flicks and ran 26 2 miles there Pray for Red Stick https t co A8pfGZQ5bN,patrickwilson73,0.8225,3
2016-08-15 02:56:48+00:00,Yes  Yes you can  Congrats  And Amen  Woohoo  https t co nAgk2ZNWsA,patrickwilson73,0.9022,3
2016-08-13 20:48:01+00:00,RIP indeed    https t co vHj7jflGzP,patrickwilson73,0,3
2016-08-12 14:17:35+00:00,Thanks  man  https t co Pk29jvqk6b,patrickwilson73,0.4404,3
2016-08-12 00:54:19+00:00,Sorry  it was a surprise but in about a half hour it will no longer be  And yes  I'll be here Saturday  https t co lvvu4144BI,patrickwilson73,0.2846,3
2016-08-11 23:12:47+00:00,I dunno what you're talking about  I'm just hanging out in downtown Brooklyn  Like you do    https t co hUA3tkNnod,patrickwilson73,0.3612,3
2016-08-11 15:08:14+00:00,Yes  we did  And a big thanks to the crew of El Toro we saw you a lot    https t co 6BDyP3DGyf,patrickwilson73,0.6808,3
2016-08-06 21:15:17+00:00,Shoot for Alan Quatermain then hope for the best  https t co ke0750N9Je,patrickwilson73,0.6908,3
2016-08-06 12:57:49+00:00,I'd like to wish my dear co star and friend Verna Flamingo the happiest of birthdays  Veronica Farmingdale  Vern Fargima ,patrickwilson73,0.9349,3
2016-08-06 04:14:02+00:00,ICYMI   H o l y  crap that was a blast  Thx  amp  for the show and the shine    https t co UPPFfgw6RZ,patrickwilson73,-0.0258,3
2016-08-05 02:52:55+00:00,H o l y  crap that was a blast  Thx  amp  for the show and the shine  https t co j5wKgLUtDf,patrickwilson73,-0.0258,3
2016-08-04 18:34:02+00:00,There are so many jokes here and I'm going to avoid ALL of them and say now I know where you brush your teeth  https t co 1YJfKUuqdv,patrickwilson73,0.0202,3
2016-08-04 15:06:05+00:00,Oh man  A local legend lost   RIP https t co wNEtuAlgf4,patrickwilson73,-0.3182,3
2016-08-02 21:35:29+00:00,Flabby Drip and the Shittiness were a very solid 90's band  I saw them open up for Toad the Wet Sprocket  Perhaps  https t co 0iSOKr8YYm,patrickwilson73,0.2247,3
2016-08-01 19:33:13+00:00,Great shot  https t co gNj83IQm77,patrickwilson73,0.6249,3
2016-07-27 01:54:19+00:00,ICYMI   Thanks  amp  for the killer time and hospitality    https t co Bqz9tkwzZl,patrickwilson73,-0.34,3
2016-07-25 14:35:41+00:00,Great times indeed  Just having my coffee now and about to dance with Mr  Brownstone  Wait  Forget it  https t co dkOBNmeZyE,patrickwilson73,0.4939,3
2016-07-25 14:33:11+00:00,Thanks  amp  for the killer time and hospitality   GnFnR   https t co 6UHNRj3AoL,patrickwilson73,-0.34,3
2016-07-22 19:36:09+00:00,Woohoo    https t co 3ob6ULZTrn,patrickwilson73,0.5106,3
2016-07-21 01:26:47+00:00,Agreed about the filmmaker part  not the bed shitting  https t co pgtWyOdqV3,patrickwilson73,0.5318,3
2016-07-18 00:34:49+00:00,I like to use Twitter to quietly  in front of millions  thousands wish my beautiful wife a happy birthday  I love you  Daggy D ,patrickwilson73,0.9517,3
2016-07-04 13:15:37+00:00,Every year  yo  We just love the animatronic house band  https t co i5u0qTqcOu,patrickwilson73,0.6369,3
2016-07-04 13:14:28+00:00,Thank you for all the birthday wishes  And now  let's all sing for America  Haaapy Birthday day to you ,patrickwilson73,0.4767,3
2016-06-30 23:08:59+00:00,Solid reference  Rubbin's racin'  And we did lose  dammit  I'm still rocking this pose AS I NO LOOK TEXT  https t co nQ6OXkQtJv,patrickwilson73,-0.6166,3
2016-06-30 21:45:05+00:00,Ah crap  https t co y86NjN1sJ8,patrickwilson73,-0.3818,3
2016-06-30 19:05:50+00:00,Shit yeah  Polska  Woohoo   Lewandowski  POLvsPOR,patrickwilson73,0.2263,3
2016-06-30 01:16:52+00:00,Yes  https t co UisUJRaMQU,patrickwilson73,0.4019,3
2016-06-25 12:33:01+00:00,Dzien Dobre  Let's do this Polska   EURO2016,patrickwilson73,0,3
2016-06-23 23:44:42+00:00,Yes  https t co W4RDdngUfs,patrickwilson73,0.4019,3
2016-06-22 01:39:02+00:00,He's really really good at soccer  Holy crap   Messi  USAvARG,patrickwilson73,0.2195,3
2016-06-20 13:05:23+00:00,Congrats to Seth Rudetsky for all your hard work and the Broadway community for showing support  https t co Wx3rttIa3j,patrickwilson73,0.6908,3
2016-06-19 22:56:16+00:00,Thanks buddy    hope you are well  https t co W6WobzIFFF,patrickwilson73,0.7845,3
2016-06-19 13:51:41+00:00,Happy Father's Day to dad's  young and old   amp  a special one to mine  You set the standard   ,patrickwilson73,0.7506,3
2016-06-19 13:48:33+00:00,Thanks man    https t co yDOZ73d7ly,patrickwilson73,0.4404,3
2016-06-19 00:40:12+00:00,Happy Anniversary  my love  How's it going downstairs  https t co vWYD06yb4v,patrickwilson73,0.836,3
2016-06-15 16:53:55+00:00,Am I wearing blush  https t co 1t9SrBvXlz,patrickwilson73,0,3
2016-06-13 04:39:05+00:00,Congrats to fellow Tartans and on their  TonyAwards   Hamilton,patrickwilson73,0.5267,3
2016-06-13 04:33:29+00:00,Yes indeed  Congrats to Great year great team great town    https t co MUx8naS4xz,patrickwilson73,0.9607,3
2016-06-12 16:53:13+00:00,If you are in central Florida  Donate if you can  Please call 888 936 6283 https t co 1dBtFKAUHC,patrickwilson73,0.3182,3
2016-06-12 16:48:21+00:00,Nice job    persevere  https t co z72FRbJwvi,patrickwilson73,0.4215,3
2016-06-10 13:13:49+00:00,Now I can talk about it  What a dream  What a legend  The album is fantastic   now go see   https t co HwXfmb9vE9,patrickwilson73,0.6808,3
2016-06-10 04:08:29+00:00,Great times  And yes  I forgot the plot of Salem's Lot  I just remember the creepy kid floating in the window  https t co mBMwu36P8p,patrickwilson73,0.7783,3
2016-06-09 23:05:23+00:00,I'm Bagwell to your Biggio  yo  https t co dDhii7Mya0,patrickwilson73,0,3
2016-06-09 18:22:17+00:00,Thank you  And thank YOU   Grizzly Adams  https t co 7BnLQnsvv8,patrickwilson73,0.6124,3
2016-06-08 21:05:33+00:00,Thanks  lady  Youaintsobadyerself    https t co YosRVDVcmA,patrickwilson73,0.4404,3
2016-06-08 21:04:02+00:00,Look  It's a Three's Company reboot  I'm Chrissy  is Jack Tripper  and yes  is Janet  https t co TY80H4hmfE,patrickwilson73,0.4019,3
2016-06-08 20:51:48+00:00,Good times had by all  Go See it this weekend in a big  loud theater   TheConjuring2 https t co TY80H4hmfE,patrickwilson73,0.4404,3
2016-06-08 18:32:01+00:00,have fun  Damn you  https t co lsormyleoW,patrickwilson73,0.1531,3
2016-06-08 18:30:15+00:00,Mom win indeed although the red carpet woulda been prettier with you on it  https t co lsusrEPEde,patrickwilson73,0.7845,3
2016-06-07 18:05:42+00:00,See you there    https t co RrbULgqxKL,patrickwilson73,0,3
2016-06-06 17:49:10+00:00,This is FANTASTIC and you don't have to speak Portuguese   But it will help  https t co 6RZZ0N165n,patrickwilson73,0.7365,3
2016-06-05 04:49:15+00:00, UFC199 YES ,patrickwilson73,0.4019,3
2016-06-04 09:30:03+00:00,ICYMI   Get on the bus  people  Thank you London for a great trip especially all of you FrightFes  https t co z9BC1chXtv,patrickwilson73,0.765,3
2016-06-03 22:19:22+00:00,Milk duds  Check  Coke  Check  Diapers  CHECK  https t co RQTZ7rlL9m,patrickwilson73,0,3
2016-06-03 17:05:15+00:00,You have no idea how angry I am  Please tell him  umm  there's a certain tour I'd like to get tickets to  https t co oaMpySacXR,patrickwilson73,0.1027,3
2016-06-02 22:08:46+00:00,Get on the bus  people  Thank you London for a great trip especially all of you FrightFest folks  https t co 5C51VAEyBC,patrickwilson73,0.765,3
2016-05-29 15:42:51+00:00,So cool  Her hair is a magical force  indeed  https t co q99rXFggrw,patrickwilson73,0.3804,3
2016-05-27 19:36:23+00:00,Happy Birthday to my axe wielding boat cruising song writing 'nole loving anchorman ,patrickwilson73,0.802,3
2016-05-27 03:06:21+00:00,Helluva series  Fantastic season to the great city of Pittsburgh and We'll be back   GoBolts  ,patrickwilson73,0.8271,3
2016-05-26 15:35:38+00:00,You are indeed  so wan  https t co 6bZti9nUNu,patrickwilson73,0,3
2016-05-23 03:10:21+00:00,It's done  Crazy game    https t co eiS75mc91U,patrickwilson73,-0.34,3
2016-05-23 00:08:10+00:00,settle in and go to work   GoBolts  BeTheThunder,patrickwilson73,0,3
2016-05-19 15:40:58+00:00,Turns out there's not a ton of Bolts fans in Mexico City  Hard to find the game  What'd I miss   I kid  Go get 'em Friday ,patrickwilson73,-0.25,3
2016-05-19 05:34:49+00:00,ICYMI   I think my dog actually thinks I'm  StanleyCup Go Bolts   and go see   https t co oSSPH4VZBS,patrickwilson73,0,3
